{
  "$schema": "http://json-schema.org/draft-07/schema#",
  "title": "OpenContextVaultMemoryEntry",
  "type": "object",
  "required": ["id", "source", "kind", "content", "createdAt", "updatedAt", "sensitivity"],
  "properties": {
    "id": { "type": "string", "minLength": 3 },
    "source": { "type": "string", "minLength": 1 },
    "kind": { "type": "string", "enum": ["event", "preference", "task", "knowledge"] },
    "content": { "type": "string", "minLength": 1 },
    "tags": {
      "type": "array",
      "items": { "type": "string" }
    },
    "createdAt": { "type": "string", "format": "date-time" },
    "updatedAt": { "type": "string", "format": "date-time" },
    "sensitivity": { "type": "string", "enum": ["low", "medium", "high"] },
    "links": {
      "type": "array",
      "items": { "type": "string" }
    }
  },
  "additionalProperties": false
}
